<?xml version="1.0" encoding="UTF-8" standalone="no"?>
<platform_data
    xmlns="http://www.arm.com/project_type"
    xmlns:peripheral="http://com.arm.targetconfigurationeditor"
    xmlns:xi="http://www.w3.org/2001/XInclude"
    xmlns:xsi="http://www.w3.org/2001/XMLSchema-instance"
    type="HARDWARE"
    xsi:schemaLocation="http://www.arm.com/project_type ../../../Schemas/platform_data-1.xsd">
    <flash_config>CDB://keil-lpc1768_flash.xml</flash_config>
    <project_type_list>
        <project_type type="BARE_METAL">
            <name language="en">Bare Metal Debug</name>
            <description language="en">This allows a bare-metal debug connection.</description>
            <execution_environment id="BARE_METAL">
                <name language="en">Bare Metal Debug</name>
                <description language="en">Connect to a platform using CMSIS-DAP</description>
                <param default="CDB://mbed_lpc1768.rvc" id="config_file" type="string" visible="false"/>
                <activity id="ICE_DEBUG" type="Debug">
                    <name language="en">Debug Cortex-M3</name>
                    <description language="en">Arm Debugger will connect to CMSIS-DAP to debug a bare metal application. See http://mbed.org/handbook/Arm DS for more information.</description>
                    <connection_type language="en">CMSIS-DAP</connection_type>
                    <core connection_id="Cortex-M3">
                        <core_definition>Cortex-M3</core_definition>
                    </core>
                    <xi:include href="../../../Include/mbed_browse_script.xml"/>
                    <xi:include href="../../../Include/mbed_setup_script.xml"/>
                    <xi:include href="../../../Include/hardware_address.xml"/>
                </activity>
            </execution_environment>
        </project_type>
    </project_type_list>
</platform_data>
