<?xml version="1.0" encoding="UTF-8" standalone="no"?>
<!--Copyright (C) 2009-2015 ARM Limited. All rights reserved.--><platform_data xmlns="http://www.arm.com/project_type" xmlns:peripheral="http://com.arm.targetconfigurationeditor" xmlns:xi="http://www.w3.org/2001/XInclude" xmlns:xsi="http://www.w3.org/2001/XMLSchema-instance" type="RTSM" xsi:schemaLocation="http://www.arm.com/project_type ../../../Schemas/platform_data-1.xsd">
    <project_type_list>
        <project_type type="BARE_METAL">
            <name language="en">Bare Metal Debug</name>
            <description language="en">This allows a bare-metal debug connection.</description>
            <execution_environment id="BARE_METAL">
                <name language="en">Bare Metal Debug</name>
                <description language="en">Connect to the simulation via the CADI interface</description>
                <param default="CDB://cadi_config.xml" id="config_file" type="string" visible="false"/>
                <!--The model_params param enables the model parameters field in the launch configuration. The parameters are passed to the setup_script.-->
                <param default="" id="model_params" type="string" visible="true">
                    <name>Model parameters</name>
                    <description>Model parameters</description>
                </param>
                <!--The script below is used to launch the model, if its executable is known. It can be used as a basis for more specific scripts.-->
                <setup_script>
                    <name>CDB://Scripts/rtsm_launcher.py</name>
                    <arguments>FVP_MPS2_Cortex-M3</arguments>
                </setup_script>
                <activity id="ICE_DEBUG" type="Debug">
                    <name language="en">Debug Cortex-M3</name>
                    <xi:include href="../../../Include/bare_metal_fvp_activity_description.xml"/>
                    <core connection_id="ARM_Cortex-M3">
                        <core_definition>Cortex-M3</core_definition>
                    </core>
                    <param default="CDB://dtsl_config_script.py" id="dtsl_config_script" type="string" visible="false"/>
                    <param default="DtslScript" id="dtsl_config" type="string" visible="false"/>
                    <param default="options.traceBuffer.traceCaptureDevice" id="dtsl_tracecapture_option" type="string" visible="false"/>
                </activity>
            </execution_environment>
        </project_type>
    </project_type_list>
</platform_data>
